{
  "$schema": "http://json-schema.org/draft-07/schema#",
  "$id": "https://github.com/jacky18008/pea-princess/blob/main/skills/vet-flat/references/plan-schema.json",
  "title": "vet-flat plan",
  "description": "Part of Pea Princess (vet-flat) by Hsien Hao (Jacky) Chen - https://github.com/jacky18008/pea-princess - CC BY 4.0. The planner's output in the role pipeline (references/pipeline.md): what to fetch, what to paste and what to ask, before anybody has read a page. THE PLANNER DECIDES WHAT TO GET, NEVER WHAT SURVIVES. It may add axes, scripts, paste requests and questions to the scaffold that scripts/plan.py prints; it may not drop anything the scaffold marked required, and scripts/plan.py --check says whether it did. There is no verdict in this file, no finding, and no number read off a page: a planner that has read a page has already stopped being a planner.",
  "type": "object",
  "additionalProperties": false,
  "required": [
    "schema",
    "budget_mode",
    "tier",
    "axes",
    "fixed_form_ids"
  ],
  "properties": {
    "schema": {
      "type": "string",
      "const": "vet-flat/plan/1",
      "description": "Always the literal \"vet-flat/plan/1\"."
    },
    "case": {
      "type": [
        "string",
        "null"
      ],
      "description": "A short label for the flat this plan is for. Never an address in a shared file.",
      "maxLength": 120
    },
    "budget_mode": {
      "type": "string",
      "enum": [
        "lite",
        "standard",
        "deep"
      ],
      "description": "The budget mode from profile.yaml (references/budget-modes.md). It sets how many axes and how many fetches the plan is allowed to ask for."
    },
    "tier": {
      "type": "string",
      "enum": [
        "lite",
        "standard",
        "deep",
        "breadth",
        "manual",
        "gate",
        "full"
      ],
      "description": "The fixed-form tier, which decides how many of the fixed questions this run owes an answer to. The mapping lives in the `tiers` block of references/fixed-questions.yaml and nowhere else."
    },
    "axes": {
      "type": "array",
      "minItems": 1,
      "description": "The axes this run will work, one entry each, in the order they should be started. Executors are handed one GROUP of these at a time.",
      "items": {
        "$ref": "#/definitions/planned_axis"
      }
    },
    "fixed_form_ids": {
      "type": "array",
      "description": "The fixed-question ids (F1 ... F18) this run owes an answer to, from the tier. Never counted in code: read from references/fixed-questions.yaml.",
      "items": {
        "type": "string",
        "pattern": "^F[0-9]{1,2}$"
      }
    },
    "user_questions": {
      "type": "array",
      "description": "Everything to ask the user, ONCE, in one message. Each item says what is wanted, where it comes from and why it matters. An empty list means nothing needs asking.",
      "items": {
        "type": "string",
        "minLength": 1,
        "maxLength": 400
      }
    },
    "notes": {
      "type": [
        "string",
        "null"
      ],
      "description": "Anything the executors need to know that is not an axis: a postcode that spans two buildings, a listing that names no flat number.",
      "maxLength": 1000
    }
  },
  "definitions": {
    "planned_axis": {
      "type": "object",
      "additionalProperties": false,
      "required": [
        "id",
        "group",
        "required"
      ],
      "properties": {
        "id": {
          "type": "integer",
          "minimum": 1,
          "maximum": 12,
          "description": "The axis number, 1 to 12, as in report-schema.json."
        },
        "name": {
          "type": [
            "string",
            "null"
          ],
          "description": "The axis name in plain words, for a human reading the plan.",
          "maxLength": 80
        },
        "group": {
          "type": "string",
          "description": "The executor group this axis belongs to. One executor takes one group, so axes that share a fetch share a group.",
          "minLength": 1,
          "maxLength": 40
        },
        "required": {
          "type": "boolean",
          "description": "true when the scaffold put this axis in the plan for this budget mode. A required axis may not be dropped; scripts/plan.py --check fails when one is missing."
        },
        "scripts": {
          "type": "array",
          "description": "The script commands to run for this axis, as argument templates. A placeholder in angle brackets - <postcode>, <lat>, <destination> - is filled in by the executor from the profile or from an earlier item, never guessed.",
          "items": {
            "$ref": "#/definitions/planned_call"
          }
        },
        "sources": {
          "type": "array",
          "description": "Source ids from references/sources.yaml this axis may read. A source not listed here is not off limits, but adding one is a decision worth writing down.",
          "items": {
            "type": "string",
            "minLength": 1,
            "maxLength": 64
          }
        },
        "paste_requests": {
          "type": "array",
          "description": "What only the user can supply for this axis, in the words the user will be asked: the page, where it is, and why it matters.",
          "items": {
            "type": "string",
            "minLength": 1,
            "maxLength": 400
          }
        }
      }
    },
    "planned_call": {
      "type": "object",
      "additionalProperties": false,
      "required": [
        "cmd"
      ],
      "properties": {
        "cmd": {
          "type": "string",
          "description": "The command line, relative to the skill folder, for example \"scripts/epc.py search --postcode <postcode>\". One command, no shell pipes, no chaining.",
          "minLength": 1,
          "maxLength": 400
        },
        "why": {
          "type": [
            "string",
            "null"
          ],
          "description": "One short sentence: what this call is for.",
          "maxLength": 240
        },
        "required": {
          "type": "boolean",
          "description": "true when the scaffold asked for this call. Defaults to false for a call the planner added."
        },
        "fallback": {
          "type": "boolean",
          "description": "true for a call to run only when the axis's primary call returned nothing or failed. Run it before writing unknown, and record the attempt under tried either way."
        }
      }
    }
  }
}
